{
  "$schema": "http://json-schema.org/draft-04/schema#",
  "type": "object",
  "title": "book",
  "properties": {
    "id": {
      "type": "string"
    },
    "title": {
      "type": "string"
    },
    "author": {
      "type": "string"
    },
    "quantity": {
      "type": "number",
      "minimum": 0
    }
  }
}
